{
  "version": "1.0",
  "workflow_id": "6f1c2a4e-1111-4b8a-9a1b-123456789abc",
  "title": "Create a New Repository in Gitea",
  "description": "Step-by-step interactive walkthrough demonstrating how to create a repository.",
  "viewport": {
    "width": 1280,
    "height": 720,
    "device_scale_factor": 1.0
  },
  "fps": 30,
  "total_duration_ms": 3200,
  "scenes": [
    {
      "id": "scene-1",
      "step_index": 1,
      "title": "Click New Repository in the top-right + menu",
      "duration_ms": 1600,
      "camera": {
        "scale": 1.35,
        "center_x": 1220,
        "center_y": 25,
        "easing": "cubic-bezier(0.22, 1, 0.36, 1)",
        "pan_duration_ms": 450
      },
      "cursor": {
        "path": [
          { "x": 640, "y": 360 },
          { "x": 800, "y": 200 },
          { "x": 1100, "y": 80 },
          { "x": 1220, "y": 25 }
        ],
        "start_ms": 400,
        "end_ms": 1000,
        "click_ms": 1150,
        "click_type": "single",
        "ripple": {
          "enabled": true,
          "radius": 24,
          "color": "rgba(99, 102, 241, 0.4)"
        }
      },
      "highlight": {
        "bbox": [1200, 10, 40, 30],
        "style": "pulsing_ring",
        "padding": 8,
        "color": "#4f46e5"
      },
      "caption": {
        "text": "Click New Repository in the top-right plus menu.",
        "words": [
          { "word": "Click", "start_ms": 100, "end_ms": 350 },
          { "word": "New", "start_ms": 360, "end_ms": 550 },
          { "word": "Repository", "start_ms": 560, "end_ms": 850 },
          { "word": "in", "start_ms": 860, "end_ms": 950 },
          { "word": "the", "start_ms": 960, "end_ms": 1050 },
          { "word": "top-right", "start_ms": 1060, "end_ms": 1300 },
          { "word": "plus", "start_ms": 1310, "end_ms": 1450 },
          { "word": "menu.", "start_ms": 1460, "end_ms": 1600 }
        ]
      },
      "rrweb_slice": {
        "start_timestamp": 100,
        "end_timestamp": 1700,
        "baseline_snapshot_event_index": 0
      },
      "scroll": {
        "x": 0,
        "y": 0
      }
    },
    {
      "id": "scene-2",
      "step_index": 2,
      "title": "Type the repository name",
      "duration_ms": 1600,
      "camera": {
        "scale": 1.35,
        "center_x": 450,
        "center_y": 280,
        "easing": "cubic-bezier(0.22, 1, 0.36, 1)",
        "pan_duration_ms": 450
      },
      "cursor": {
        "path": [
          { "x": 1220, "y": 25 },
          { "x": 950, "y": 120 },
          { "x": 650, "y": 220 },
          { "x": 450, "y": 280 }
        ],
        "start_ms": 350,
        "end_ms": 950,
        "click_ms": 1050,
        "click_type": "single",
        "ripple": {
          "enabled": true,
          "radius": 24,
          "color": "rgba(99, 102, 241, 0.4)"
        }
      },
      "highlight": {
        "bbox": [320, 260, 260, 40],
        "style": "solid_box",
        "padding": 6,
        "color": "#4f46e5"
      },
      "caption": {
        "text": "Type the repository name in the input field.",
        "words": [
          { "word": "Type", "start_ms": 100, "end_ms": 350 },
          { "word": "the", "start_ms": 360, "end_ms": 500 },
          { "word": "repository", "start_ms": 510, "end_ms": 800 },
          { "word": "name", "start_ms": 810, "end_ms": 1050 },
          { "word": "in", "start_ms": 1060, "end_ms": 1180 },
          { "word": "the", "start_ms": 1190, "end_ms": 1300 },
          { "word": "input", "start_ms": 1310, "end_ms": 1450 },
          { "word": "field.", "start_ms": 1460, "end_ms": 1600 }
        ]
      },
      "rrweb_slice": {
        "start_timestamp": 1700,
        "end_timestamp": 3300,
        "baseline_snapshot_event_index": 0
      },
      "scroll": {
        "x": 0,
        "y": 0
      }
    }
  ]
}
